<?xml version="1.0" encoding="utf-8" ?>
<items xmlns="http://gamebooks.zagor.hu" xmlns:xsi="http://www.w3.org/2001/XMLSchema-instance" xsi:schemaLocation="http://gamebooks.zagor.hu http://zagor.hu/xsd/ff-items.xsd">
  <item name="Ököl" id="defWpn" type="weapon1" addToSkill="-4" weaponSubType="weakBlunt" staminaDamage="2" />
  <item name="Kard" id="1001" type="weapon1" forceEquip="true" weaponSubType="edged" staminaDamage="2" />
  <item type="common" id="1002" name="Mágikus íj" />
  <item type="weapon1" id="1003" name="Lidérckard" addToInitialSkill="1" addToSkill="1" />
  <item type="weapon1" id="1004" name="Lándzsa" />


  <item name="Élelmiszer" id="2000" type="provision" addToStamina="4" />
  <item name="Ügyesség Itala" id="2001" type="potion" dose="1" addToSkill="12" />
  <item name="Erő Itala" id="2002" type="potion" dose="1" addToStamina="24" />
  <item name="Szerencse Itala" id="2003" type="potion" dose="1" addToLuck="12" addToInitialLuck="1" />
  <item name="Szerencse Itala" id="2004" type="potion" dose="1" addToLuck="12" />
  <item name="Gyógyital" id="2005" type="potion" dose="1" addToStamina="6" />

  <item name="Bőrpáncél" id="3001" type="armour" forceEquip="true" />
  <item type="helmet" id="3002" name="Sisak" forceEquip="true" />
  <item type="common" id="3003" name="Sóska" />
  <item type="common" id="3004" name="Kulacs" />
  <item type="common" id="3005" name="Kötél" />
  <item type="ring" id="3006" name="Gránátgyűrű" />
  <item type="common" id="3007" name="Kristálytükör" />
  <item type="common" id="3008" name="Rézérc" />
  <item type="common" id="3009" name="Csákány" />
  <item type="common" id="3010" name="Vörösréz fülbevaló" />
  <!-- 8 mag, 11 sárkány -->
  <item type="common" id="3011" name="Snattamacska agyar" />
  <item type="common" id="3012" name="Bőrszütyő" />
  <!-- aka. Cholumbara -->
  <item type="common" id="3013" name="Kő istenszobor" />
  <item type="common" id="3014" name="Jogar" />
  <item type="common" id="3015" name="Tigriskarom" />
  <item type="common" id="3016" name="Hever Kürtje" preFight="true" />
  <item type="common" id="3017" name="Pillanatnyi Láthatatlanság Köpenye" />
  <item type="common" id="3018" name="Fagykenőcs" />
  <item type="boots" id="3019" name="Fürgeség Csizmája" />
  <item type="common" id="3020" name="Ékköves Nyakpánt" />
  <item type="cloak" id="3021" name="Vadmacska Bunda" />
  <!-- 21 -->
  <item type="common" id="3023" name="Országalma" />
  <item type="boots" id="3024" name="Hótalp" />


  <item type="shadow" id="4001" name="Can ask for Galrin's help" />
  <item type="shadow" id="4002" name="Not eaten in a given amount of time" />
  <item type="shadow" id="4003" name="Marker for food purchase" />
  <item type="shadow" id="4004" name="Hit the peasants" />
  <item type="shadow" id="4005" name="First Mordida is rabbid" />
  <item type="shadow" id="4006" name="Reset skill" />
  <item type="shadow" id="4007" name="Reset stamina" />
  <item type="shadow" id="4008" name="Reset luck" />
  <item type="shadow" id="4009" name="Unbound" />
  <item type="shadow" id="4010" name="Snow Cub's first hit" />
  <item type="shadow" id="4011" name="Cursed by Morgana" />

  <!-- Garlin: 100 // 85, 346 -->
  <!-- Új kulacs ha van, 2000 stamina 4 -->

</items>
