<?xml version="1.0" encoding="utf-8" ?>
<items xmlns="http://gamebooks.zagor.hu" xmlns:xsi="http://www.w3.org/2001/XMLSchema-instance" xsi:schemaLocation="http://gamebooks.zagor.hu http://zagor.hu/xsd/ff-items.xsd">
  <item name="Ököl" id="defWpn" type="weapon1" addToSkill="-3" weaponSubType="weakBlunt" staminaDamage="2" />
  <item name="Kard" id="1001" type="weapon1" forceEquip="true" weaponSubType="edged" staminaDamage="2" />
  <item type="weapon1" id="1002" name="Tőr" weaponSubType="edged" staminaDamage="2" addToSkill="-2" />
  <item type="weapon1" id="1003" name="Szent Kard" weaponSubType="edged" staminaDamage="2" addToSkill="1"/>

  <item name="Élelmiszer" id="2000" type="provision" addToStamina="4" />
  <item name="Ügyesség Itala" id="2001" type="potion" dose="1" addToSkill="12" />
  <item name="Erő Itala" id="2002" type="potion" dose="1" addToStamina="24" />
  <item name="Szerencse Itala" id="2003" type="potion" dose="1" addToLuck="12" addToInitialLuck="1" />
  <item type="provision" id="2004" name="Alma" addToStamina="4" />
  <item type="provision" id="2005" name="Fűz nedve" addToStamina="4" />

  <item name="Bőrpáncél" id="3001" type="armour" forceEquip="true" />
  <item name="Lámpás" id="3002" type="common" />
  <item type="necklace" id="3003" name="Haláltalizmán" />

  <item type="shadow" id="4001" name="Captain critical hit" />
  <item type="shadow" id="4002" name="Death Knight battle is bad" />


</items>
