<?xml version="1.0" encoding="utf-8" ?>
<items xmlns="http://gamebooks.zagor.hu" xmlns:xsi="http://www.w3.org/2001/XMLSchema-instance" xsi:schemaLocation="http://gamebooks.zagor.hu http://zagor.hu/xsd/ff-items.xsd">
  <item id="defWpn" name="Ököl" type="weapon1" weaponSubType="weakBlunt" staminaDamage="2" addToSkill="-2" removable="false" />
  <item type="weapon1" id="1001" name="Katana" weaponSubType="edged" staminaDamage="2" forceEquip="true" />
  <item type="weapon1" id="1002" name="Wakizashi" weaponSubType="edged" staminaDamage="2" addToSkill="-1" />
  <item type="weapon1" id="1003" name="Daloló Halál" weaponSubType="edged" staminaDamage="2" forceEquip="true" addToInitialLuck="2" addToLuck="2" addToInitialSkill="2" addToSkill="2" addToInitialStamina="4" addToStamina="4" />

  <item name="Élelmiszer" id="2000" type="provision" addToStamina="4" />
  <item type="potion" id="2001" name="Gyógyital" addToStamina="5" />

  <item name="Pajzs" id="3001" type="shield" forceEquip="true" />
  <item type="armour" id="3002" name="Páncélruha" forceEquip="true" damageProtection="2" />
  <item type="common" id="3003" name="A Shogun Pecsétje" removable="false" />
  <item type="common" id="3004" name="Szamurájíj" />
  <item type="common" id="3005" name="Shinmen fejkendője" />
  <item type="armour" id="3006" name="Szamurájpáncél" addToSkill="1" damageProtection="2" />
  <item type="common" id="3007" name="Vaslegyező" description="Fehér alapon kilenc arany nyílvessző mutat egy kék kör belseje felé." />
  <item type="common" id="3008" name="Zavarodottság Sisakja" />
  <item type="common" id="3009" name="Rézkulcs" addToSkill="-1" />
  <item type="common" id="3010" name="Pergamen" />
  <item type="common" id="3011" name="Selyemkép" />
  <item type="common" id="3012" name="Agancsdarab" />
  <item type="common" id="3013" name="Főnix alakú rubin" />
  <item type="necklace" id="3014" name="Váratlan Körülmények Talizmánja" />
  <item type="common" id="3015" name="Elefántcsont kürt" />
  <item type="armour" id="3016" name="A Hetedik Pecsét Seregének vértje" damageProtection="2" addToSkill="1" />
  <item type="common" id="3017" name="Fekete fabot" />
  <item type="common" id="3018" name="A Tudás Vize" />


  <item type="common" id="3101" name="Fűzlevelű vessző" description="2 [span class='ffAttribute']ÉLETERŐ[/span] pontot sebez" />
  <item type="common" id="3102" name="Bélfürkész vessző" description="3 [span class='ffAttribute']ÉLETERŐ[/span] pontot sebez" />
  <item type="common" id="3103" name="Páncéltörő vessző" description="2 [span class='ffAttribute']ÉLETERŐ[/span] pontot sebez, de csak bizonyos ellenfelekkel szemben hatásos" />
  <item type="common" id="3104" name="Süvítő gömb vessző" description="1 [span class='ffAttribute']ÉLETERŐ[/span] pontot sebez, de röptében félelmetes hangot ad" />
  <item type="common" id="3105" name="Tsunevara vessző" />

  <item type="shadow" id="4000" name="1 arrow against the Tiger" />
  <item type="shadow" id="4001" name="+1 attack strength" />
  <item type="shadow" id="4002" name="Killed first without suffering damage" />
  <item type="shadow" id="4003" name="Won the Tatsu" />
  <item type="shadow" id="4004" name="Won the Ki-Rin" />
  <item type="shadow" id="4005" name="Won the Tiger" />
  <item type="shadow" id="4006" name="Won the Phoenix" />
  <item type="shadow" id="4007" name="Won the Snake" />
  <item type="shadow" id="4008" name="Won the Golden Squadron" />
  <item type="shadow" id="4009" name="Won the Sorceress" />
  <item type="shadow" id="4010" name="Instant death at 27" />
  <item type="shadow" id="4011" name="Instant death at 199" />

</items>
