<?xml version="1.0" encoding="utf-8" ?>
<items xmlns="http://gamebooks.zagor.hu" xmlns:xsi="http://www.w3.org/2001/XMLSchema-instance" xsi:schemaLocation="http://gamebooks.zagor.hu http://zagor.hu/xsd/ff-items.xsd">
  <item name="Ököl" id="defWpn" type="weapon1" addToSkill="-4" weaponSubType="weakBlunt" staminaDamage="2" removable="false" />
  <item name="Kard" id="1001" type="weapon1" forceEquip="true" weaponSubType="edged" staminaDamage="2" />
  <item type="weapon1" id="1002" name="Opálgombos tőr" staminaDamage="2" weaponSubType="edged" addToSkill="-2" />
  <item type="weapon1" id="1003" name="Tőr" staminaDamage="2" weaponSubType="edged" addToSkill="-2" />
  <item type="weapon1" id="1004" name="Hosszú kés" staminaDamage="2" weaponSubType="edged" addToSkill="-2" />
  <item type="weapon1" id="1005" name="Görbe kard" staminaDamage="2" weaponSubType="edged" />


  <item name="Élelmiszer" id="2000" type="provision" addToStamina="4" />
  <item name="Ügyesség Itala" id="2001" type="potion" dose="1" addToSkill="12" />
  <item name="Erő Itala" id="2002" type="potion" dose="1" addToStamina="24" />
  <item name="Szerencse Itala" id="2003" type="potion" dose="1" addToLuck="12" addToInitialLuck="1" />

  <item name="Bőrpáncél" id="3001" type="armour" forceEquip="true" />
  <item name="Lámpás" id="3002" type="common" />
  <item type="shield" id="3002a" name="Pajzs" forceEquip="true" />
  <item type="common" id="3003" name="Sav" />
  <item type="bracelet" id="3004" name="Csuklóvédő" addToSkill="-4" forceEquip="true" removable="false" />
  <item type="common" id="3005" name="Kötél" />
  <item type="common" id="3007" name="Facső" />
  <item type="common" id="3008" name="Smaragdszem" />
  <item type="ring" id="3009" name="Aranygyűrű" />
  <item type="common" id="3010" name="Rubingömb" />
  <item type="common" id="3011" name="Pergamen" />
  <item type="common" id="3012" name="Fakalapács" />
  <item type="common" id="3013" name="Vasszögek" />
  <item type="common" id="3014" name="Vaskulcs" />
  <item type="common" id="3015" name="Zafír" />
  <item type="common" id="3016" name="Topáz" />
  <item type="necklace" id="3017" name="Fognyaklánc" addToSkill="1" addToStamina="1" forceEquip="true" />
  <item type="ring" id="3018" name="Druida gyűrű" forceEquip="true" addToStamina="3" />
  <item type="armour" id="3019" name="Láncköpeny" addToSkill="1" />
  <item type="common" id="3020" name="Gyöngy" />
  <item type="common" id="3021" name="Gólyaláb" />
  <item type="common" id="3022" name="Gránát" />
  <item type="helmet" id="3023" name="Szárnyas Sisak" addToSkill="1" />
  <item type="common" id="3024" name="Hasonmás Ital" />
  <item type="common" id="3025" name="Tükör" />
  <item type="common" id="3026" name="Majom kabala" />
  <item type="common" id="3027" name="Csáklya" />
  <item type="common" id="3028" name="Rézcsengő" />
  <item type="common" id="3029" name="Csont" />
  <item type="common" id="3030" name="Leprechaun-fog" addToLuck="2" />
  <item type="shield" id="3031" name="Pajzs" addToSkill="1" />
  <item type="common" id="3032" name="Gyémánt" />

  <item type="shadow" id="4002" name="Attack Strength -2" addToAttackStrength="-2" />
</items>
