<?xml version="1.0" encoding="utf-8" ?>
<items xmlns="http://gamebooks.zagor.hu" xmlns:xsi="http://www.w3.org/2001/XMLSchema-instance" xsi:schemaLocation="http://gamebooks.zagor.hu http://zagor.hu/xsd/ff-items.xsd">
  <item id="defWpn" name="Ököl" type="weapon1" weaponSubType="weakBlunt" staminaDamage="2" backpackSize="0" removable="false" />
  <item id="1000" name="Ököl" type="weapon1" weaponSubType="weakBlunt" staminaDamage="2" backpackSize="0" />
  <item type="weapon1" id="1001" name="Lézerkard" staminaDamage="2" forceEquip="true" />
  <item type="weapon1" id="1002" name="Lézerkarabély" />

  <item type="provision" id="2001" name="Gyümölcs" backpackSize="0" />
  <item type="provision" id="2002" name="Monyóka gyógyfőzet" backpackSize="0" />
  <item type="potion" id="2003" name="Gyógyital" addToStamina="4" />

  <item type="common" id="3001" name="Gomb" />
  <item type="common" id="3002" name="Benelo-foszfát gömb" />
  <item type="common" id="3003" name="Kéziduda" />
  <item type="common" id="3004" name="Nejlonkötél" />
  <item type="common" id="3005" name="Motorolaj" />
  <item type="common" id="3006" name="Üzenetrögzítő és manikűröző robot" />
  <item type="bracelet" id="3007" name="Zirídium karkötő" />
  <item type="common" id="3008" name="Infravörös pásztázó" />
  <item type="common" id="3009" name="Bárion-gránát" />
  <item type="common" id="3010" name="Kulcscsomó" />
  <item type="common" id="3011" name="Mágneslemezek" />
  <item type="common" id="3012" name="Drótvágó olló" />
  <item type="common" id="3013" name="Hátrakéta" />
  <item type="common" id="3014" name="Élelem" />
  <item type="common" id="3015" name="Bot" />
  <item type="common" id="3016" name="Agyszonda" />
  <item type="common" id="3017" name="Elmonit robbanóanyag" />
  <item type="common" id="3018" name="Fotongránát" />
  <item type="common" id="3019" name="Tapadóakna" />

  <item type="shadow" id="4001" name="Ettünk az első nap" />
  <item type="shadow" id="4366" name="Harc előtti teendők - 366" />
  <item type="shadow" id="4295" name="Harc előtti teendők - 295" />
  <item type="shadow" id="4256" name="Benzin és gömb egyben" />
  <item type="shadow" id="4351" name="Az Arkád köpött" />

  <item type="shadow" id="4002" name="Van egy megbeszélt időpontunk" />
  <item type="shadow" id="4003" name="-1 ügyesség" addToSkill="-1" />
  <item type="shadow" id="4004" name="Utcai Harcosról hallottunk" />
  <item type="shadow" id="4005" name="Eltörtük a botot" />
  <item type="shadow" id="4006" name="Még nem sebződtünk" />
  <item type="shadow" id="4007" name="Kitart az ügyesség-veszteség" />
  <item type="shadow" id="4008" name="Ismerjük a kódot" />

</items>
