<?xml version="1.0" encoding="utf-8" ?>
<items xmlns="http://gamebooks.zagor.hu" xmlns:xsi="http://www.w3.org/2001/XMLSchema-instance" xsi:schemaLocation="http://gamebooks.zagor.hu http://zagor.hu/xsd/ff-items.xsd">
  <item name="Ököl" id="defWpn" type="weapon1" addToSkill="-3" weaponSubType="weakBlunt" staminaDamage="2" forceEquip="true" />
  <item type="weapon1" id="1001" name="Papírvágó kés" staminaDamage="2" />
  <item type="weapon1" id="1002" name="Húsvágó kés" staminaDamage="2" />
  <item type="weapon1" id="1003" name="Ezüst tőr" addToSkill="-1" staminaDamage="2" />
  <item type="weapon1" id="1004" name="Deszka" staminaDamage="2" />
  <item type="weapon1" id="1005" name="Kés" staminaDamage="2" />
  <item type="weapon1" id="1006" name="Gyöngyháznyelű tőr" staminaDamage="2" />
  <item type="weapon1" id="1007" name="Kris tőr" staminaDamage="2" magical="true" />

  <item type="common" id="3001" name="Kötél" />
  <item type="common" id="3002" name="Fokhagyma" />
  <item type="ring" id="3003" name="Rubinköves aranygyűrű" />
  <item type="common" id="3004" name="Aranykulcs" />
  <!-- 27-es kulcs -->
  <item type="common" id="3005" name="Öntöttvas kulcs" />
  <item type="common" id="3006" name="Konyak" />
  <item type="necklace" id="3007" name="Talizmán" />
  <item type="common" id="3008" name="Könyv" />
  <item type="common" id="3009" name="Fekete folyadék" />

  <item type="shadow" id="4001" name="Támadóerő -2" addToAttackStrength="-2" />

  <item type="shadow" id="4002" name="Diabolus - 3" />
  <item type="shadow" id="4003" name="Drumer - 5" />

  <item type="shadow" id="4004" name="Azazel - 3" />
  <item type="shadow" id="4005" name="Abaddon - 5" />
  <item type="shadow" id="4006" name="Asmodeus - 3" />
  <item type="shadow" id="4007" name="Apollyon - 3" />

  <item type="shadow" id="4008" name="Kelnor - 5" />
  <item type="shadow" id="4009" name="Kris - 3" />

  <item type="shadow" id="4010" name="Mammon - 3" />
  <item type="shadow" id="4011" name="Mordana - 5" />

  <item type="shadow" id="4012" name="Shekou - 5" />
  <item type="shadow" id="4013" name="Shaitan - 3" />

  <item type="immediate" id="5001" name="Víz" addToStamina="2" />

  <item type="immediate" id="5002" name="Kenyér" addToStamina="2" />
  <item type="immediate" id="5003" name="Sütemény" addToStamina="2" />

  <item type="immediate" id="5004" name="Szárított hús" addToStamina="1" />
  <item type="immediate" id="5005" name="Szárított hal" addToStamina="1" />
  <item type="immediate" id="5006" name="Sajt" addToStamina="1" />

  <item type="immediate" id="5007" name="Fehér bor" addToSkill="-1" />
  <item type="immediate" id="5008" name="Vörös bor" addToSkill="-1" />

  <item type="immediate" id="5009" name="Gyümölcs" />

</items>
