<?xml version="1.0" encoding="utf-8" ?>
<items xmlns="http://gamebooks.zagor.hu" xmlns:xsi="http://www.w3.org/2001/XMLSchema-instance" xsi:schemaLocation="http://gamebooks.zagor.hu http://zagor.hu/xsd/ff-items.xsd">
  <item name="Ököl" id="defWpn" type="weapon1" addToSkill="-4" weaponSubType="weakBlunt" staminaDamage="2" />
  <item name="Kard" id="1001" type="weapon1" forceEquip="true" weaponSubType="edged" staminaDamage="2" />

  <item name="Élelmiszer" id="2000" type="provision" addToStamina="4" />
  <item type="immediate" id="2001" name="Halpörkölt" addToStamina="4" />
  <item type="provision" id="2002" name="Szerencse Poros Szelence" addToLuck="1" />

  <item name="Bőrpáncél" id="3001" type="armour" forceEquip="true" />
  <item type="shield" id="3002" name="Pajzs" forceEquip="true" />
  <item type="common" id="3003" name="Rovarriasztó tégely" />
  <item type="common" id="3004" name="Üzenettekercs" description="A 3, 5, 0 számokat tudod csak kisilabizálni az írásból." />
  <item type="common" id="3005" name="Lámpás" />
  <item type="common" id="3006" name="Rózsavörös gyöngy" description="12 Aranytallér az értéke." />
  <item type="necklace" id="3007" name="Ezüstmedál" description="Egy nyitott tenyér van belevésve." />
  <item type="common" id="3008" name="Futás Itala" />

</items>
