<?xml version="1.0" encoding="utf-8" ?>
<items xmlns="http://gamebooks.zagor.hu" xmlns:xsi="http://www.w3.org/2001/XMLSchema-instance" xsi:schemaLocation="http://gamebooks.zagor.hu http://zagor.hu/xsd/ff-items.xsd">
  <item id="defWpn" name="Ököl" type="weapon1" weaponSubType="weakBlunt" staminaDamage="2" backpackSize="0" />
  <item type="weapon1" id="1001" name="Elektromos korbács" staminaDamage="2" backpackSize="0" />
  <item type="weapon1" id="1002" name="Plazmavető" staminaDamage="2" backpackSize="0" />

  <item type="provision" id="2000" name="Egészségtabletta" addToStamina="5" backpackSize="0" />
  <item type="provision" id="2001" name="Energiarúd" addToStamina="5" backpackSize="0.5" />
  <item type="provision" id="2002" name="Gyógytabletta" addToStamina="5" />

  <item type="common" id="3001" name="Gránát" backpackSize="0" />
  <item type="common" id="3002" name="Gravitációs bomba" backpackSize="0" />
  <item type="common" id="3003" name="Fekete szerkentyű" />
  <item type="common" id="3004" name="BIZ henger" />
  <item type="common" id="3005" name="Ideggáz" />
  <item type="common" id="3006" name="Ismeretlen tabletták" />
  <item type="common" id="3007" name="Döglött rák" />
  <item type="common" id="3008" name="Szerkentyű" />
  <item type="common" id="3009" name="Infravörös látókészülék" />
  <item type="common" id="3010" name="Kazetta" />
  <item type="common" id="3011" name="Csapágyas henger" />
  <item type="common" id="3012" name="Műanyag doboz" />
  <item type="common" id="3013" name="Kártyacsomag" />
  <item type="common" id="3014" name="Fekete folyadékos üvegcse" />
  <item type="common" id="3015" name="A Földöntúli Lények Enciklopédiája" />
  <item type="common" id="3016" name="Android fej" backpackSize="2" />
  <item type="common" id="3017" name="Gyümölcs" backpackSize="0" />

  <item type="shadow" id="4001" name="We have a squirell with us" />
  <item type="shadow" id="4999" name="Item that we will never have" />

</items>
