<?xml version="1.0" encoding="utf-8" ?>
<items xmlns="http://gamebooks.zagor.hu" xmlns:xsi="http://www.w3.org/2001/XMLSchema-instance" xsi:schemaLocation="http://gamebooks.zagor.hu http://zagor.hu/xsd/ff-items.xsd">
  <item id="defWpn" name="Ököl" type="weapon1" weaponSubType="weakBlunt" staminaDamage="2" />
  <item name="Kard" id="1001" type="weapon1" forceEquip="true" weaponSubType="edged" staminaDamage="2" />

  <item name="Bőrpáncél" id="3001" type="armour" forceEquip="true" />


  <item id="stamina" name="Életerő Varázslat" type="common" />
  <item id="strength" name="Erő Varázslat" type="common" />
  <item id="weakness" name="Erőtlenség Varázslat" type="common" />
  <item id="foolsGold" name="Hamis Arany Varázslat" type="common" />
  <item id="illusion" name="Illúzió Varázslat" type="common" />
  <item id="esp" name="Különleges Érzékelő Készség Varázslat" type="common" />
  <item id="levitation" name="Súlytalanság Varázslat" type="common" />
  <item id="luck" name="Szerencse Varázslat" type="common" />
  <item id="creatureCopy" name="Teremtmény Hasonmás Varázslat" type="common" />
  <item id="fire" name="Tűz Varázslat" type="common" />
  <item id="skill" name="Ügyesség Varázslat" type="common" />
  <item id="shielding" name="Védelem Varázslat" type="common" />

</items>
