<?xml version="1.0" encoding="utf-8" ?>
<items xmlns="http://gamebooks.zagor.hu" xmlns:xsi="http://www.w3.org/2001/XMLSchema-instance" xsi:schemaLocation="http://gamebooks.zagor.hu http://zagor.hu/xsd/ff-items.xsd">
  <item name="Ököl" id="defWpn" type="weapon1" addToSkill="-4" weaponSubType="weakBlunt" staminaDamage="2" />
  <item name="Kard" id="1001" type="weapon1" forceEquip="true" weaponSubType="edged" staminaDamage="2" />


  <item name="Élelmiszer" id="2000" type="provision" addToStamina="4" />
  <item name="Ügyesség Itala" id="2001" type="potion" dose="2" addToSkill="12" />
  <item name="Erő Itala" id="2002" type="potion" dose="2" addToStamina="24" />
  <item name="Szerencse Itala" id="2003" type="potion" dose="2" addToLuck="12" addToInitialLuck="1" />

  <item name="Bőrpáncél" id="3001" type="armour" forceEquip="true" />
  <item type="common" id="3002" name="Bronzkulcs" description="99" />
  <item type="common" id="3003" name="Láthatatlanság Itala" />
  <item type="gloves" id="3004" name="Selyemkesztyű" />
  <item type="shield" id="3005" name="Arany Félholdas Pajzs" />
  <item type="common" id="3006" name="Sajt" />
  <item type="common" id="3007" name="Íj és nyílvessző" />
  <item type="common" id="3008" name="Bronzkulcs" description="9"/>

  <item type="shadow" id="4001" name="+1 AS" addToAttackStrength="1" />
  <item type="shadow" id="4005" name="We won at least once against the old man"/>
  
  
</items>
