<?xml version="1.0" encoding="utf-8" ?>
<items xmlns="http://gamebooks.zagor.hu" xmlns:xsi="http://www.w3.org/2001/XMLSchema-instance" xsi:schemaLocation="http://gamebooks.zagor.hu http://zagor.hu/xsd/ff-items.xsd">
  <item name="Ököl" id="defWpn" type="weapon1" weaponSubType="weakBlunt" staminaDamage="2" removable="false" />
  <item name="Ököl" id="1000" type="weapon1" weaponSubType="weakBlunt" staminaDamage="2" forceEquip="true" />
  <item type="shooting" id="1001" name="Lézerkarabély" staminaDamage="4" forceEquip="true" />
  <item type="shooting" id="1002" name="Automata lézerkarabély" staminaDamage="6" forceEquip="true" />

  <item name="Egészségtabletta" id="2000" type="provision" addToStamina="6" />

  <item type="common" id="3001" name="Kézigránát" preFight="true" />
  <item type="common" id="3002" name="Kulcs" />
  <item type="common" id="3003" name="Satophil-D" />

  <item type="shadow" id="4001" name="Tudunk a C230-ról" />
  <item type="shadow" id="4002" name="Elpusztult az űrhajónk" />
  <item type="shadow" id="4003" name="Thuvald imája" />
  <item type="shadow" id="4004" name="Egy adag üzemanyag" />
  <item type="shadow" id="4005" name="Autó mocsaras" addToSkill="-1" />
</items>
