<?xml version="1.0" encoding="utf-8" ?>
<items xmlns="http://gamebooks.zagor.hu" xmlns:xsi="http://www.w3.org/2001/XMLSchema-instance" xsi:schemaLocation="http://gamebooks.zagor.hu http://zagor.hu/xsd/ff-items.xsd">
  <item name="Kard" id="allyWeapon" type="weapon1" staminaDamage="2" forceEquip="true" />
  <item name="Ököl" id="defWpn" type="weapon1" addToSkill="-4" weaponSubType="weakBlunt" staminaDamage="2" removable="false" />
  <item name="Kard" id="1001" type="weapon1" forceEquip="true" weaponSubType="edged" staminaDamage="2" />
  <item type="weapon1" id="1002" name="Mágikus Kard" weaponSubType="edged" staminaDamage="2" magical="true" />
  <item type="weapon1" id="1003" name="Éjcsillag" weaponSubType="edged" staminaDamage="2" magical="true" addToAttackStrength="1" />

  <item name="Élelmiszer" id="2000" type="provision" addToStamina="4" actions="2" />
  <item type="potion" id="2001" name="Brandy" dose="2" addToStamina="4" />
  <item type="potion" id="2002" name="Mágikus Gyógyfőzet" addToStamina="4" />
  <item type="potion" id="2003" name="Gyógyital" addToStamina="4" />
  <item type="potion" id="2004" name="Brandy" addToStamina="4" />

  <item name="Bőrpáncél" id="3001" type="armour" forceEquip="true" />
  <item name="Lámpás" id="3002" type="common" />
  <item type="shield" id="3003" name="Pajzs" forceEquip="true" />
  <item type="necklace" id="3004" name="Fokhagymafüzér" forceEquip="true" />
  <item type="common" id="3005" name="Heydrich Amulet" price="3" />
  <item type="common" id="3006" name="Ezüst karkötő" price="3" />
  <item type="common" id="3007" name="Kristályüvegcse" price="4" />
  <item type="shield" id="3008" name="Hit Pajzsa" />
  <item type="common" id="3009" name="Ezüst Kulcs" />
  <item type="common" id="3010" name="Evőeszközök" price="4" />
  <item type="common" id="3011" name="Ezüst Tükör" />
  <item type="common" id="3012" name="Gyógyítók Könyve" />
  <item type="common" id="3013" name="Kardok Könyve" />
  <item type="common" id="3014" name="Ékszerek" price="7" />
  <item type="common" id="3015" name="Ezüst Cövek" />
  <item type="common" id="3016" name="Lothar kulcscsomója" />
  <item type="common" id="3017" name="Kristálymadarak" price="3" />
  <item type="common" id="3018" name="Elf imalánc" />
  <item type="common" id="3019" name="Ezüst-ametiszt Melltű" price="2" />
  <item type="ring" id="3020" name="Regeneráló Gyűrű" />
  <item type="common" id="3021" name="Csecsebecsék" price="4" />
  <item type="common" id="3022" name="Szentent Víz" />
  <item type="common" id="3023" name="Levelek" />
  <item type="common" id="3024" name="Aranybross" price="7" />
  <item type="common" id="3025" name="Kriptakulcs" />
  <item type="armour" id="3026" name="Siegfried Láncinge" addToInitialSkill="1" addToSkill="1" />
  <item type="common" id="3027" name="Ezüst Kereszt" />

  <item type="shadow" id="4001" name="Második Farkas eltalált" />
  <item type="shadow" id="4002" name="Lassan ható méreg" addToInitialStamina="-1" />
  <item type="shadow" id="4003" name="Lidérc eltalált" />
  <item type="shadow" id="4004" name="Baobhan Sith átka" />
  <item type="shadow" id="4005" name="Automatikus sebesülés" />
  <item type="shadow" id="4006" name="+1 TE" addToAttackStrength="1" />
  <item type="shadow" id="4007" name="Megölni Lothart Katarina parancsára" />
  <item type="shadow" id="4008" name="Megölni Lothart Katarina kérésére" />
  <item type="shadow" id="4009" name="Békénhagyni Lothart" />
  <item type="shadow" id="4010" name="Túl sok italozás" />
  <item type="shadow" id="4011" name="Túl sok italozás" addToSkill="-1" />
  <item type="shadow" id="4012" name="Ránk tapadt a Menyét" />
  <item type="shadow" id="4013" name="Erős Csapás aktív" />
  <item type="shadow" id="4014" name="Jandor Nyila aktív" />
  <item type="shadow" id="4015" name="Zúzás aktív" />
  <item type="shadow" id="4016" name="Ki kell nyírni a nagy Thalost" />
  <item type="shadow" id="4017" name="Tovább adófka sírjához" />
  <item type="shadow" id="4018" name="Egy automata találat a grófnak" />
  <item type="shadow" id="4019" name="Koporsó kinyiffantva" />
  <item type="shadow" id="4020" name="Kiszabadítottuk a lányt" actions="2" />
  <item type="shadow" id="4021" name="Egyszer már ettünk" />
  <item type="shadow" id="4022" name="Csak egyszer csökken az ügyesség" />

  <item type="shadow" id="4101" name="Lassan Ható Méreg" />
  <item type="shadow" id="4102" name="Likantrópia" />
  <item type="shadow" id="4103" name="Holló Átka" />
  <item type="shadow" id="4104" name="Súlyos Likantrópia" />
  <item type="shadow" id="4105" name="Baobhan Sith Átka" addToSkill="-2" />
  <item type="shadow" id="4106" name="Gyógyító Átka" />
  <item type="shadow" id="4107" name="Denevér Átka" />

  <item type="shadow" id="4213" name="Erőfal" />
  <item type="shadow" id="4214" name="Erős Csapás" />
  <item type="shadow" id="4215" name="Jandor Nyila" />
  <item type="shadow" id="4216" name="Szerencsevarázs" />
  <item type="shadow" id="4217" name="Zúzás" />
  <item type="shadow" id="4218" name="Igaz Gyógyítás" />

</items>
