<?xml version="1.0" encoding="utf-8" ?>
<items xmlns="http://gamebooks.zagor.hu" xmlns:xsi="http://www.w3.org/2001/XMLSchema-instance" xsi:schemaLocation="http://gamebooks.zagor.hu http://zagor.hu/xsd/ff-items.xsd">
  <item name="Kard" id="allyWeapon" type="weapon1" staminaDamage="2" forceEquip="true" />
  <item name="Ököl" id="defWpn" type="weapon1" addToSkill="-3" weaponSubType="weakBlunt" staminaDamage="2" removable="false" />
  <item name="Kard" id="1001" type="weapon1" forceEquip="true" weaponSubType="edged" staminaDamage="2" />
  <item name="Harci kalapács" id="1002" type="weapon1" weaponSubType="blunt" staminaDamage="2" />
  <item name="Lándzsa" id="1003" type="weapon1" weaponSubType="edged" staminaDamage="2" />
  <item name="Tőr" id="1004" type="weapon1" weaponSubType="edged" staminaDamage="2" />
  <item name="Gyorsaság Kardja" id="1005" type="weapon1" addToSkill="1" forceEquip="true" weaponSubType="edged" staminaDamage="2" />
  <item name="Pompás kard" id="1006" type="weapon1" addToSkill="1" />

  <item name="Élelmiszer" id="2000" type="provision" addToStamina="4" />
  <item name="Ügyesség Itala" id="2001" type="potion" dose="2" addToSkill="12" />
  <item name="Erő Itala" id="2002" type="potion" dose="2" addToStamina="24" />
  <item name="Szerencse Itala" id="2003" type="potion" dose="2" addToLuck="12" addToInitialLuck="1" />

  <item name="Bőrpáncél" id="3001" type="armour" forceEquip="true" />
  <item name="Lámpás" id="3002" type="common" />
  <item name="Köpeny" id="3003" type="cloak" />
  <item name="Sózott hal" id="3004" type="provision" addToStamina="4" />
  <item name="Gyertyatartó" id="3005" type="common" />
  <item name="Gyertya" id="3006" type="common" />
  <item name="Furulya" id="3007" type="common" />
  <item name="Rovásíráros bot" id="3008" type="common" />
  <!-- Zöld jáde béka talizmán -->
  <item name="Bátorság Amulettje" id="3009" type="necklace" forceEquip="true" addToSkill="2" />
  <item name="Vaskulcs" id="3010" type="common" />
  <item name="Parittya" id="3011" type="common" />
  <item name="Vasgolyó" id="3012" type="common" />
  <item name="Aranygyűrű" id="3013" type="ring" forceEquip="true" />
  <item name="Rézgyűrű" id="3014" type="ring" forceEquip="true" />
  <item name="Őrölt Minótaurusz-szarv" id="3015" type="common" />
  <item name="Fokhagyma" id="3016" type="common" />
  <item name="Fogas doboz" id="3017" type="common" />
  <item name="Pácolt gyíkfarok" id="3018" type="common" />
  <item name="Sárkánytojás" id="3019" type="common" />
  <item name="Fémkorong" id="3020" type="common" />
  <item name="Elf-Ősök Csizmája" id="3021" type="boots" />
  <item name="Fémcsillag" id="3022" type="common" />
  <item name="Fémnégyzet" id="3023" type="common" />
  <item name="Pajzs" id="3024" type="shield" addToSkill="1" forceEquip="true" />
  <item name="Szarvas Sisak" id="3025" type="helmet" />
  <item name="Tűzszerszám" id="3026" type="common" />
  <item name="Ezüst nyílhegy" id="3027" type="common" />
  <item name="Réz karpánt" id="3028a" type="bracelet" addToSkill="1" forceEquip="true" />
  <item name="Réz karpánt" id="3028b" type="bracelet" addToSkill="1" />

  <item type="shadow" id="4100" name="-2 támadóerő" addToAttackStrength="-2" />
</items>
