<?xml version="1.0" encoding="utf-8" ?>
<items xmlns="http://gamebooks.zagor.hu" xmlns:xsi="http://www.w3.org/2001/XMLSchema-instance" xsi:schemaLocation="http://gamebooks.zagor.hu http://zagor.hu/xsd/ff-items.xsd">
  <item id="defWpn" name="Ököl" type="weapon1" staminaDamage="2" addToSkill="-3" removable="false" />
  <item id="1001" name="Kard" type="weapon1" staminaDamage="2" forceEquip="true" />
  <item type="weapon1" id="3003" name="Szigony" weaponSubType="edged" staminaDamage="2" />
  <item type="weapon1" id="1004" name="Dárda" weaponSubType="edged" addToSkill="1" addToInitialSkill="1" staminaDamage="1" forceEquip="true" />

  <item type="provision" id="2000" name="Élelmiszer" addToStamina="4" />
  <item name="Ügyesség Itala" id="2001" type="potion" dose="2" addToSkill="12" />
  <item name="Erő Itala" id="2002" type="potion" dose="2" addToStamina="24" />
  <item name="Szerencse Itala" id="2003" type="potion" dose="2" addToLuck="12" addToInitialLuck="1" />

  <item type="shield" id="3001" name="Pajzs" forceEquip="true" />
  <item type="armour" id="3002" name="Bőrvért" forceEquip="true" />
  <item type="common" id="1002" name="Ékköves tőr" />
  <item type="common" id="3004" name="Kőszilánk" />
  <item type="common" id="3005" name="Csontdarab" />
  <item type="common" id="3006" name="Mágikus Kötél" />
  <item type="common" id="3007" name="Bőr" />
  <item type="common" id="3008" name="Vörös toll" />
  <item type="common" id="3009" name="Jeti karom" />
  <item type="bracelet" id="3010" name="Fém talizmán" forceEquip="true" />
  <item type="common" id="3011" name="Gyémánt" />
  <item type="common" id="3012" name="Bőr erszény" />
  <item type="common" id="3013" name="Arany kötél" />
  <item type="common" id="3014" name="Furulya" />
  <item type="common" id="3015" name="Átalakító Ital" />
  <item type="common" id="3016" name="Fülvédő" />
  <item type="common" id="3017" name="Kígyóbőr" />
  <item type="necklace" id="3018" name="Rubin medál" />
  <item type="common" id="3019" name="Fa szálka" />
  <item type="common" id="3020" name="Arany toll" />

  <item type="shadow" id="4001" name="Small Jeti hit us" />
</items>
