<?xml version="1.0" encoding="utf-8" ?>
<items xmlns="http://gamebooks.zagor.hu" xmlns:xsi="http://www.w3.org/2001/XMLSchema-instance" xsi:schemaLocation="http://gamebooks.zagor.hu http://zagor.hu/xsd/ff-items.xsd">
  <item name="Ököl" id="defWpn" type="weapon1" addToSkill="-3" weaponSubType="weakBlunt" staminaDamage="2" />
  <item name="Kard" id="1001" type="weapon1" forceEquip="true" weaponSubType="edged" staminaDamage="2" />
  <item type="weapon1" id="1002" name="Kardcsonk" weaponSubType="edged" staminaDamage="2" forceEquip="true" addToSkill="-2" />
  <item type="weapon1" id="1003" name="Mesterkard" weaponSubType="edged" staminaDamage="2" forceEquip="true" addToInitialSkill="2" />

  <item name="Élelmiszer" id="2000" type="provision" addToStamina="4" />
  <item name="Ügyesség Itala" id="2001" type="potion" dose="2" addToSkill="12" />
  <item name="Erő Itala" id="2002" type="potion" dose="2" addToStamina="24" />
  <item name="Szerencse Itala" id="2003" type="potion" dose="2" addToLuck="12" addToInitialLuck="1" />

  <item name="Bőrpáncél" id="3001" type="armour" forceEquip="true" />
  <item name="Lámpás" id="3002" type="common" />
  <item type="common" id="3003" name="Vasrúd" />
  <item type="common" id="3004" name="Dárda" />
  <item type="necklace" id="3005" name="Csontamulett" />
  <item type="common" id="3006" name="Drót" />
  <item type="common" id="3007" name="Kisbalta" />
  <item type="common" id="3008" name="Tekercs kötél" />
  <item type="helmet" id="3009" name="Sog Sisakja" forceEquip="true" />
  <item type="common" id="3010" name="Aranyrög" />
  <item type="common" id="3011" name="Figyelmeztető cédula"
    description="Ha a kezedbe kerül ez az írás, az azt jelenti, hogy nem sikerült megszabadulnom a Gyíkkirály rabszolgabányájából. Tutajom a szurdok mögött van elrejtve, a folyóparton. Ha azért jöttél a szigetre, hogy segíts nekünk, kérlek, hajózz fölfelé a folyón egészen addig, míg meg nem pillantod sárkunyhóinkat. A rabszolgabányák közel vannak, de óvakodj a Gyíkember őreitől." />
  <item type="boots" id="3012" name="Csizma" />
  <item type="common" id="3013" name="Feneketlen Zsák" />
  <item type="ring" id="3014" name="Ügyetlenség Gyűrűje" addToSkill="-2" removable="false" forceEquip="true" />
  <item type="common" id="3015" name="Vaskulcsok" />
  <item type="common" id="3016" name="Vadászkürt" />
  <item type="common" id="3017" name="Kővé dermedt Grannitusz" />
  <item type="common" id="3018" name="Rézsíp" />
  <item type="common" id="3019" name="Toll" />

  <item type="shadow" id="4001" name="-1 Attack Strength" addToAttackStrength="-1" />
  <item type="shadow" id="4002" name="Lost against giant wasp" />
  <item type="shadow" id="4003" name="Succeeded on a Shaman-trial" />

</items>
